{
  "$schema": "http://json-schema.org/draft-07/schema#",
  "$id": "https://opentdf.io/spec/testvectors/kao/vector.schema.json",
  "title": "BaseTDF KAO Test Vector",
  "description": "A single conformance test vector for the BaseTDF Key Access Object. Each vector is a self-contained JSON document that any language implementation can load and execute against the BaseTDF-KAO conformance assertions.",
  "type": "object",
  "required": ["id", "description", "conformance", "category", "algorithm", "inputs", "expected"],
  "additionalProperties": false,
  "properties": {
    "id": {
      "type": "string",
      "pattern": "^[a-z0-9]+(-[a-z0-9]+)*$",
      "description": "Globally unique kebab-case identifier (e.g., 'pos-rsa-oaep-256-001'). Identifiers are append-only and immutable across spec revisions."
    },
    "description": {
      "type": "string",
      "minLength": 1,
      "description": "Human-readable explanation of what the vector exercises."
    },
    "conformance": {
      "type": "array",
      "minItems": 1,
      "uniqueItems": true,
      "items": {
        "type": "string",
        "pattern": "^KAO-C-\\d{3}$",
        "description": "Conformance assertion identifier from BaseTDF-KAO-CONF."
      },
      "description": "One or more conformance assertions exercised by this vector."
    },
    "category": {
      "type": "string",
      "enum": ["positive", "negative", "legacy", "kat"],
      "description": "Vector category. 'positive': successful round-trip. 'negative': implementations MUST reject with the documented error. 'legacy': v4.3 backward-compatibility behavior. 'kat': known-answer test pinning a specific cryptographic constant or computation."
    },
    "algorithm": {
      "type": "string",
      "enum": [
        "RSA-OAEP",
        "RSA-OAEP-256",
        "ECDH-HKDF",
        "ML-KEM-768",
        "ML-KEM-1024",
        "X-ECDH-ML-KEM-768",
        "mixed",
        "n/a"
      ],
      "description": "The algorithm under test, or 'mixed' for split vectors that exercise multiple algorithms, or 'n/a' for vectors that test purely structural concerns."
    },
    "manifestSchemaVersion": {
      "type": "string",
      "description": "The TDF manifest schema version this vector targets (e.g., '4.4.0', '4.3.0')."
    },
    "inputs": {
      "type": "object",
      "required": ["kao"],
      "additionalProperties": false,
      "properties": {
        "kao": {
          "type": "object",
          "description": "The KAO under test. Should validate (or fail to validate, for negative vectors) against schema/BaseTDF/kao.schema.json."
        },
        "policy": {
          "type": "string",
          "description": "Canonical policy form: the Base64-encoded policy JSON exactly as it appears in encryptionInformation.policy in the manifest. Required for any vector that exercises policy-binding verification."
        },
        "keys": {
          "type": "object",
          "description": "References to test keys used by this vector, keyed by role (e.g., 'kas', 'kasEC', 'kasMLKEM'). Each value is the relative path of a key bundle under 'keys/'.",
          "additionalProperties": {
            "type": "string",
            "pattern": "^keys/[A-Za-z0-9._-]+$"
          }
        },
        "dekShare": {
          "type": "string",
          "pattern": "^[0-9a-f]*$",
          "description": "Hex-encoded DEK share for this KAO. Required for KAT vectors that pin a specific HMAC or HKDF computation; OPTIONAL for positive vectors where the DEK is recovered through the unwrap operation."
        },
        "shares": {
          "type": "array",
          "items": {
            "type": "string",
            "pattern": "^[0-9a-f]*$"
          },
          "description": "Hex-encoded DEK shares ordered by KAO position, for split vectors. The full DEK is the XOR of all shares."
        },
        "fullDek": {
          "type": "string",
          "pattern": "^[0-9a-f]*$",
          "description": "Hex-encoded reconstructed DEK, for split vectors that assert reconstruction success."
        }
      }
    },
    "expected": {
      "type": "object",
      "required": ["outcome"],
      "additionalProperties": false,
      "properties": {
        "outcome": {
          "type": "string",
          "enum": ["accept", "reject"],
          "description": "Whether a conformant implementation MUST accept or reject the input."
        },
        "errorCode": {
          "type": "string",
          "pattern": "^kao\\.[a-z_]+$",
          "description": "Required when outcome is 'reject'. One of the error codes in BaseTDF-KAO-CONF §3."
        },
        "policyBindingValid": {
          "type": "boolean",
          "description": "Whether the policy binding verifies successfully. Independent of outcome (e.g., a KAO can have a valid binding but still be rejected for another reason)."
        },
        "recoveredDek": {
          "type": "string",
          "pattern": "^[0-9a-f]*$",
          "description": "Hex-encoded DEK (or DEK share, for non-split vectors) that a conformant implementation MUST recover. Only meaningful when outcome is 'accept'."
        },
        "recoveredMetadata": {
          "type": "object",
          "description": "JSON object that a conformant implementation MUST recover from encryptedMetadata after successful policy-binding verification.",
          "additionalProperties": true
        },
        "normalizedKao": {
          "type": "object",
          "description": "The KAO after alias resolution to v4.4 canonical form (alg, kas, protectedKey, ephemeralKey, structured policyBinding)."
        }
      },
      "allOf": [
        {
          "if": { "properties": { "outcome": { "const": "reject" } } },
          "then": { "required": ["errorCode"] }
        }
      ]
    }
  }
}
