{
  "id": "neg-ephemeral-key-required-mlkem-001",
  "description": "alg=ML-KEM-768 but ephemeralKey is absent.",
  "conformance": [
    "KAO-C-030"
  ],
  "category": "negative",
  "algorithm": "ML-KEM-768",
  "manifestSchemaVersion": "4.4.0",
  "inputs": {
    "kao": {
      "alg": "ML-KEM-768",
      "kas": "https://kas.example.com",
      "kid": "ml-kem-768-test",
      "sid": "s-0",
      "protectedKey": "AAAAAAAAAAAAAAAAAAAAAAAAAAAAAAAAAAAAAAAAAAAAAAAAAAAAAAAAAAAAAAAAAAAAAAAAAAAAAAAAAAAAAAAAAAAAAAAAAAAAAAAAAAAAAAAAAAAAAAAAAAAAAAAAAAAAAAAAAAAAAAAAAAAAAAAAAAAAAAAAAAAAAAAAAAAAAAAAAAAAAAAAAAAAAAAAAAAAAAAAAAAAAAAAAAAAAAAAAAAAAAAAAAAAAAAAAAAAAAAAAAAAAAAAAAAAAAAAAAAAAAAAAAAAAAAAAAAAAAAAAAAAAAAAAAAAAAAAAAAAAAAAAAAAAAAAAAAAAAAAAAAAAAAAAAAAAAAAAAAAAA==",
      "policyBinding": {
        "alg": "HS256",
        "hash": "AAAAAAAAAAAAAAAAAAAAAAAAAAAAAAAAAAAAAAAAAAA="
      }
    },
    "policy": "eyJ1dWlkIjoiMTIzNDU2NzgtMTIzNC00MzIxLTk4NzYtMTIzNDU2Nzg5YWJjIiwiYm9keSI6eyJkYXRhQXR0cmlidXRlcyI6W3siYXR0cmlidXRlIjoiaHR0cHM6Ly9leGFtcGxlLmNvbS9hdHRyL0NsYXNzaWZpY2F0aW9uL3ZhbHVlL1B1YmxpYyJ9XSwiZGlzc2VtIjpbXX19"
  },
  "expected": {
    "outcome": "reject",
    "errorCode": "kao.ephemeral_key_required"
  }
}
